{
  "scaffold_id": "SCAF-003",
  "scaffold_name": "1,2,3-triazole (1,4-disubstituted)",
  "display_name": "1,4-Disubstituted 1,2,3-triazole",
  "core_smiles": "c1cnnn1",
  "core_smarts": "[#6]1:[#6]:[#7]:[#7]:[#7]:1",
  "numbering_image_ref": "triazole_14_numbering.png",
  "positions": {
    "C4": {
      "atom_type": "C",
      "hybridization": "sp2",
      "is_ring_junction": false,
      "is_bridgehead": false,
      "substitutable": true,
      "default_H_count": 1,
      "notes": "Triazole C-H position, typically substituted in 1,4-disubstituted derivatives"
    },
    "C5": {
      "atom_type": "C",
      "hybridization": "sp2",
      "is_ring_junction": false,
      "is_bridgehead": false,
      "substitutable": true,
      "default_H_count": 1,
      "notes": "Triazole C-H position, often bears substituent in 1,4-disubstituted pattern"
    },
    "N1": {
      "atom_type": "N",
      "hybridization": "sp2",
      "is_ring_junction": false,
      "is_bridgehead": false,
      "substitutable": true,
      "default_H_count": 0,
      "notes": "Nitrogen typically substituted in 1,4-disubstituted triazoles"
    },
    "N2": {
      "atom_type": "N",
      "hybridization": "sp2",
      "is_ring_junction": false,
      "is_bridgehead": false,
      "substitutable": false,
      "default_H_count": 0,
      "notes": "Internal nitrogen, not substitutable"
    },
    "N3": {
      "atom_type": "N",
      "hybridization": "sp2",
      "is_ring_junction": false,
      "is_bridgehead": false,
      "substitutable": false,
      "default_H_count": 0,
      "notes": "Internal nitrogen, not substitutable"
    }
  },
  "h1_shifts": {
    "C5": {
      "base_shift": 7.8,
      "range": [
        7.6,
        8.2
      ],
      "typical_multiplicity": "s",
      "typical_J": "none",
      "substituent_effects": [
        {
          "substituent": "-OMe",
          "position_of_substituent": "C4",
          "delta_shift": -0.3,
          "new_range": [
            7.3,
            7.6
          ],
          "note": "Electron-donating effect upfield"
        },
        {
          "substituent": "-NO2",
          "position_of_substituent": "C4",
          "delta_shift": 0.4,
          "new_range": [
            8.0,
            8.6
          ],
          "note": "Strong electron-withdrawing effect"
        },
        {
          "substituent": "-Cl",
          "position_of_substituent": "C4",
          "delta_shift": 0.1,
          "new_range": [
            7.7,
            8.3
          ],
          "note": "Weak electron-withdrawing effect"
        },
        {
          "substituent": "-Ph",
          "position_of_substituent": "C4",
          "delta_shift": 0.2,
          "new_range": [
            7.8,
            8.4
          ],
          "note": "Aromatic conjugation effect"
        },
        {
          "substituent": "-COCH3",
          "position_of_substituent": "C4",
          "delta_shift": 0.3,
          "new_range": [
            7.9,
            8.5
          ],
          "note": "Carbonyl electron-withdrawing effect"
        }
      ],
      "solvent_effects": {
        "CDCl3": 7.8,
        "DMSO-d6": 8.1,
        "CD3OD": 8.0,
        "D2O": 8.2
      }
    }
  },
  "c13_shifts": {
    "C4": {
      "base_shift": 124.5,
      "range": [
        122.0,
        127.0
      ],
      "carbon_type": "CH",
      "dept_phase": "up",
      "substituent_effects": [
        {
          "substituent": "-OMe",
          "position_of_substituent": "C5",
          "delta_shift": -2.5,
          "new_range": [
            119.5,
            124.5
          ],
          "note": "Electron-donating upfield shift"
        },
        {
          "substituent": "-NO2",
          "position_of_substituent": "C5",
          "delta_shift": 3.2,
          "new_range": [
            125.2,
            130.2
          ],
          "note": "Strong deshielding effect"
        },
        {
          "substituent": "-Cl",
          "position_of_substituent": "C5",
          "delta_shift": 1.8,
          "new_range": [
            123.8,
            128.8
          ],
          "note": "Moderate deshielding"
        },
        {
          "substituent": "-Ph",
          "position_of_substituent": "C5",
          "delta_shift": 2.1,
          "new_range": [
            124.1,
            129.1
          ],
          "note": "Aromatic deshielding"
        }
      ]
    },
    "C5": {
      "base_shift": 147.8,
      "range": [
        145.0,
        150.0
      ],
      "carbon_type": "CH",
      "dept_phase": "up",
      "substituent_effects": [
        {
          "substituent": "-OMe",
          "position_of_substituent": "C4",
          "delta_shift": -3.1,
          "new_range": [
            141.9,
            146.9
          ],
          "note": "Electron-donating upfield shift"
        },
        {
          "substituent": "-NO2",
          "position_of_substituent": "C4",
          "delta_shift": 2.8,
          "new_range": [
            147.8,
            152.8
          ],
          "note": "Electron-withdrawing deshielding"
        },
        {
          "substituent": "-Cl",
          "position_of_substituent": "C4",
          "delta_shift": 1.2,
          "new_range": [
            146.2,
            151.2
          ],
          "note": "Weak deshielding effect"
        },
        {
          "substituent": "-Ph",
          "position_of_substituent": "C4",
          "delta_shift": 1.5,
          "new_range": [
            146.5,
            151.5
          ],
          "note": "Aromatic conjugation effect"
        }
      ]
    }
  },
  "ir_bands": {
    "present": [
      {
        "band_range": [
          1550,
          1450
        ],
        "intensity": "strong",
        "assignment": "C=N and C=C stretching of triazole ring"
      },
      {
        "band_range": [
          1200,
          1000
        ],
        "intensity": "medium",
        "assignment": "C-N stretching vibrations"
      },
      {
        "band_range": [
          850,
          750
        ],
        "intensity": "medium",
        "assignment": "Triazole ring breathing and C-H out-of-plane bending"
      }
    ],
    "absent": [
      {
        "band_range": [
          3300,
          3100
        ],
        "assignment": "N-H stretch",
        "significance": "Confirms N-substitution in 1,4-disubstituted pattern"
      },
      {
        "band_range": [
          1700,
          1650
        ],
        "assignment": "C=O stretch (unless carbonyl substituent present)",
        "significance": "Distinguishes from amide or ester derivatives"
      }
    ]
  },
  "diagnostic_features": [
    "Single triazole C-H appears as singlet around 7.8 ppm in 1H NMR",
    "Two distinct carbon signals in 13C NMR: C4 around 124 ppm and C5 around 148 ppm",
    "Absence of N-H stretch in IR confirms N-substitution pattern",
    "DEPT shows both triazole carbons as CH (positive phase)",
    "Triazole C-H is typically the most downfield aromatic proton",
    "Characteristic IR absorption pattern at 1550-1450 cm⁻¹ for triazole ring"
  ]
}
